mysql> create database tclcommands;
Query OK, 1 row affected (2.13 sec)

mysql> use tclcommands
Database changed
mysql> create table oreder_details(order_id int,product_name varchar(100),order_num int,date Date);
Query OK, 0 rows affected (2.65 sec)

mysql> insert into oreder_details values (1,'laptop',1345,'2020-10-21'),(2,'keyboard',1365,'2021-01-21'),(3,'mouse',1545,'2018-10-11'),(4,'printer',1255,'2000-10-25'),(5,'scanner',1388,'2020-12-11');
Query OK, 5 rows affected (0.61 sec)
Records: 5  Duplicates: 0  Warnings: 0

mysql> select*from oreder_details;
+----------+--------------+-----------+------------+
| order_id | product_name | order_num | date       |
+----------+--------------+-----------+------------+
|        1 | laptop       |      1345 | 2020-10-21 |
|        2 | keyboard     |      1365 | 2021-01-21 |
|        3 | mouse        |      1545 | 2018-10-11 |
|        4 | printer      |      1255 | 2000-10-25 |
|        5 | scanner      |      1388 | 2020-12-11 |
+----------+--------------+-----------+------------+
5 rows in set (0.08 sec)

mysql> start transaction;
Query OK, 0 rows affected (0.05 sec)

mysql> insert into oreder_details values (6,'desktop',2545,'2018-09-15'),(7,'antivirus',2595,'2019-03-05');
Query OK, 2 rows affected (0.02 sec)
Records: 2  Duplicates: 0  Warnings: 0

mysql> select*from oreder_details;
+----------+--------------+-----------+------------+
| order_id | product_name | order_num | date       |
+----------+--------------+-----------+------------+
|        1 | laptop       |      1345 | 2020-10-21 |
|        2 | keyboard     |      1365 | 2021-01-21 |
|        3 | mouse        |      1545 | 2018-10-11 |
|        4 | printer      |      1255 | 2000-10-25 |
|        5 | scanner      |      1388 | 2020-12-11 |
|        6 | desktop      |      2545 | 2018-09-15 |
|        7 | antivirus    |      2595 | 2019-03-05 |
+----------+--------------+-----------+------------+
7 rows in set (0.00 sec)

mysql> rollback;
Query OK, 0 rows affected (0.10 sec)

mysql> select*from oreder_details;
+----------+--------------+-----------+------------+
| order_id | product_name | order_num | date       |
+----------+--------------+-----------+------------+
|        1 | laptop       |      1345 | 2020-10-21 |
|        2 | keyboard     |      1365 | 2021-01-21 |
|        3 | mouse        |      1545 | 2018-10-11 |
|        4 | printer      |      1255 | 2000-10-25 |
|        5 | scanner      |      1388 | 2020-12-11 |
+----------+--------------+-----------+------------+
5 rows in set (0.00 sec)

mysql> start transaction;
Query OK, 0 rows affected (0.00 sec)

mysql> 
delete from oreder_details where order_id in (3,4);
Query OK, 2 rows affected (0.00 sec)

mysql> select*from oreder_details;
+----------+--------------+-----------+------------+
| order_id | product_name | order_num | date       |
+----------+--------------+-----------+------------+
|        1 | laptop       |      1345 | 2020-10-21 |
|        2 | keyboard     |      1365 | 2021-01-21 |
|        5 | scanner      |      1388 | 2020-12-11 |
+----------+--------------+-----------+------------+
3 rows in set (0.00 sec)

mysql> commit;
Query OK, 0 rows affected (0.11 sec)

mysql> select*from oreder_details;
+----------+--------------+-----------+------------+
| order_id | product_name | order_num | date       |
+----------+--------------+-----------+------------+
|        1 | laptop       |      1345 | 2020-10-21 |
|        2 | keyboard     |      1365 | 2021-01-21 |
|        5 | scanner      |      1388 | 2020-12-11 |
+----------+--------------+-----------+------------+
3 rows in set (0.00 sec)

mysql> set autocommit=0;
Query OK, 0 rows affected (0.08 sec)

mysql> savepoint check_updates;
Query OK, 0 rows affected (0.00 sec)

mysql> update oreder_details set order_num=5544 where product_name ='laptop';
Query OK, 1 row affected (0.02 sec)
Rows matched: 1  Changed: 1  Warnings: 0

mysql> update oreder_details set product_name ='asus' where order_num=5544;
Query OK, 1 row affected (0.00 sec)
Rows matched: 1  Changed: 1  Warnings: 0

mysql> insert into oreder_details values (6,'desktop',2545,'2018-09-15'),(7,'antivirus',2595,'2019-03-05');
Query OK, 2 rows affected (0.02 sec)
Records: 2  Duplicates: 0  Warnings: 0

mysql> update oreder_details set product_name ='laptop' where order_num=2595;
Query OK, 1 row affected (0.00 sec)
Rows matched: 1  Changed: 1  Warnings: 0

mysql> savepoint check_delete;
Query OK, 0 rows affected (0.05 sec)

mysql> 
delete from oreder_details where product_name='laptop';
Query OK, 1 row affected (0.02 sec)

mysql> select*from oreder_details;
+----------+--------------+-----------+------------+
| order_id | product_name | order_num | date       |
+----------+--------------+-----------+------------+
|        1 | asus         |      5544 | 2020-10-21 |
|        2 | keyboard     |      1365 | 2021-01-21 |
|        5 | scanner      |      1388 | 2020-12-11 |
|        6 | desktop      |      2545 | 2018-09-15 |
+----------+--------------+-----------+------------+
4 rows in set (0.00 sec)

mysql> rollback to savepoint check_delete;
Query OK, 0 rows affected (0.00 sec)

mysql> select*from oreder_details;
+----------+--------------+-----------+------------+
| order_id | product_name | order_num | date       |
+----------+--------------+-----------+------------+
|        1 | asus         |      5544 | 2020-10-21 |
|        2 | keyboard     |      1365 | 2021-01-21 |
|        5 | scanner      |      1388 | 2020-12-11 |
|        6 | desktop      |      2545 | 2018-09-15 |
|        7 | laptop       |      2595 | 2019-03-05 |
+----------+--------------+-----------+------------+
5 rows in set (0.00 sec)

mysql> rollback to savepoint check_updates;
Query OK, 0 rows affected (0.06 sec)

mysql> select*from oreder_details;
+----------+--------------+-----------+------------+
| order_id | product_name | order_num | date       |
+----------+--------------+-----------+------------+
|        1 | laptop       |      1345 | 2020-10-21 |
|        2 | keyboard     |      1365 | 2021-01-21 |
|        5 | scanner      |      1388 | 2020-12-11 |
+----------+--------------+-----------+------------+
3 rows in set (0.00 sec)

mysql> commit
    -> ;
Query OK, 0 rows affected (0.00 sec)

mysql> set autocommit=1;
Query OK, 0 rows affected (0.00 sec)

mysql> select*from oreder_details;
+----------+--------------+-----------+------------+
| order_id | product_name | order_num | date       |
+----------+--------------+-----------+------------+
|        1 | laptop       |      1345 | 2020-10-21 |
|        2 | keyboard     |      1365 | 2021-01-21 |
|        5 | scanner      |      1388 | 2020-12-11 |
+----------+--------------+-----------+------------+
3 rows in set (0.02 sec)
